{"schema_version":1,"feasibility_id":"feasibility-60s","project_id":"project-1","object_version":1,"blueprint_ref":{"object_id":"duration-60s-v1","object_version":1,"digest":"aaaaaaaaaaaaaaaaaaaaaaaaaaaaaaaaaaaaaaaaaaaaaaaaaaaaaaaaaaaaaaaa"},"contract_ref":{"object_id":"contract-1","object_version":2,"digest":"bbbbbbbbbbbbbbbbbbbbbbbbbbbbbbbbbbbbbbbbbbbbbbbbbbbbbbbbbbbbbbbb"},"material_pack_ref":{"object_id":"pack-1","object_version":1,"digest":"cccccccccccccccccccccccccccccccccccccccccccccccccccccccccccccccc"},"input_fingerprint":"dddddddddddddddddddddddddddddddddddddddddddddddddddddddddddddddd","result":"feasible","target_duration":{"schema_version":1,"value":60,"timescale":1},"planned_beat_count":6,"information_density":"high","redundancy_policy":"none","emotional_curve":[{"phase":"hook","position":0,"intensity":0.9},{"phase":"setup","position":0.25,"intensity":0.55},{"phase":"turn","position":0.68,"intensity":1},{"phase":"resolution","position":1,"intensity":0.5}],"allocated_roles":[{"role_id":"hook","duration":{"schema_version":1,"value":8,"timescale":1}},{"role_id":"setup","duration":{"schema_version":1,"value":12,"timescale":1}},{"role_id":"development","duration":{"schema_version":1,"value":21,"timescale":1}},{"role_id":"turn","duration":{"schema_version":1,"value":7,"timescale":1}},{"role_id":"ending","duration":{"schema_version":1,"value":12,"timescale":1}}],"total_allocated":{"schema_version":1,"value":60,"timescale":1},"variance":{"schema_version":1,"value":0,"timescale":1},"missing_evidence_count":0,"blockers":[],"evaluated_at":"2026-08-24T00:01:00Z","provenance":{"producer":"project-host","allocator_version":"duration-allocator-v1","policy_version":"duration-policy-v1","input_refs":["aaaaaaaaaaaaaaaaaaaaaaaaaaaaaaaaaaaaaaaaaaaaaaaaaaaaaaaaaaaaaaaa","bbbbbbbbbbbbbbbbbbbbbbbbbbbbbbbbbbbbbbbbbbbbbbbbbbbbbbbbbbbbbbbb","cccccccccccccccccccccccccccccccccccccccccccccccccccccccccccccccc"]}}
